{
  "id": "io.github.dexterhere.concept-github-activity",
  "repo": "https://github.com/dexterhere/omarchy-widgets",
  "commit": "0000000000000000000000000000000000000000",
  "categories": ["dev-git", "productivity"],
  "tags": ["github", "pull-requests"],
  "summary": "Shows how many of your pull requests are open and how many reviews are waiting for you.",
  "status": "planned",
  "source": "fixture"
}
