{
  "id": "io.github.dexterhere.docker",
  "repo": "https://github.com/dexterhere/docker",
  "commit": "0000000000000000000000000000000000000000",
  "categories": ["network-containers", "dev-git"],
  "tags": ["docker", "containers"],
  "summary": "Shows how many containers are running, stopped or unhealthy, read-only.",
  "status": "planned",
  "source": "fixture"
}
