{
  "id": "io.github.dexterhere.system-monitor",
  "repo": "https://github.com/dexterhere/system-monitor",
  "commit": "0000000000000000000000000000000000000000",
  "categories": ["system", "utilities"],
  "tags": ["cpu", "memory", "temperature"],
  "summary": "Shows CPU load, memory use and temperature, with a short history graph when the widget is tall enough.",
  "status": "planned",
  "source": "fixture"
}
